{
  "schema": "mantle-radiance-source-cohort-v1",
  "members": [
    {
      "role": "radiance",
      "repository_url": "https://code.radiant.computer/radiance",
      "observation": {
        "schema": "mantle-source-observation-v1",
        "source_kind": "vcs-snapshot",
        "locator_class": "git-remote",
        "locator_hint": "https://code.radiant.computer/radiance",
        "immutable_revision": {
          "object_format": "sha256",
          "value": "0d8a2d4fe8d0ba488e22c8ed83df1e53a5d23d69489c5d9e7fa0646b1c29c444"
        },
        "normalized_projection": ".",
        "snapshot_profile": "canonical-tree-v1",
        "content_blake3": "135c2f75eea21199b4538f5f0096e3e329c6b8b70943017644f9cdef05573c66",
        "observation_blake3": "c3503ed3a34a8ea85f732205112578c76b82e7a719cedc67ed09d0f392d7069f",
        "provenance": "complete",
        "non_claim": "source-observation-binds-supplied-origin-projection-profile-and-content-facts-without-proving-ownership-trust-review-or-correctness"
      },
      "license_spdx": "MIT",
      "license_blake3": "d0f870e9de0345cb08c6ecc3367d99c12a89756d23cfec7f8260aaf1dcc888b6"
    },
    {
      "role": "bootstrap-compiler",
      "repository_url": "https://code.radiant.computer/radiance.s0",
      "observation": {
        "schema": "mantle-source-observation-v1",
        "source_kind": "vcs-snapshot",
        "locator_class": "git-remote",
        "locator_hint": "https://code.radiant.computer/radiance.s0",
        "immutable_revision": {
          "object_format": "sha256",
          "value": "7834d3a9d44fb48ae3d3c06da992922f3e46b580b3d92df36372081b2fe475c3"
        },
        "normalized_projection": ".",
        "snapshot_profile": "canonical-tree-v1",
        "content_blake3": "8c49dadd15e6834dd3204a35f4be00cf1cc01c9672c235a78a0c909b97aa8f1b",
        "observation_blake3": "5a3ce8a6f18d3fbc506ce7b39591a707aef3ac8abb45ec3a51474abee375ddcf",
        "provenance": "complete",
        "non_claim": "source-observation-binds-supplied-origin-projection-profile-and-content-facts-without-proving-ownership-trust-review-or-correctness"
      },
      "license_spdx": "MIT",
      "license_blake3": "d0f870e9de0345cb08c6ecc3367d99c12a89756d23cfec7f8260aaf1dcc888b6"
    },
    {
      "role": "emulator",
      "repository_url": "https://code.radiant.computer/emulator",
      "observation": {
        "schema": "mantle-source-observation-v1",
        "source_kind": "vcs-snapshot",
        "locator_class": "git-remote",
        "locator_hint": "https://code.radiant.computer/emulator",
        "immutable_revision": {
          "object_format": "sha256",
          "value": "92cdb0c5293447964be053214fac403b49193ac3ec07c902576346ebaa205535"
        },
        "normalized_projection": ".",
        "snapshot_profile": "canonical-tree-v1",
        "content_blake3": "a6e91a2a6edc0aa4d5ca3c870012fdfb4f14748fed2829c46f6466efab3a27ec",
        "observation_blake3": "1834bfecc3f53e448b8c0bbe8e3635e6414438c360d70460458dabc8aeb90fa4",
        "provenance": "complete",
        "non_claim": "source-observation-binds-supplied-origin-projection-profile-and-content-facts-without-proving-ownership-trust-review-or-correctness"
      },
      "license_spdx": "MIT",
      "license_blake3": "d0f870e9de0345cb08c6ecc3367d99c12a89756d23cfec7f8260aaf1dcc888b6"
    }
  ],
  "cohort_blake3": "80c82a016b6232aa4f8002624fa2fe6296ad3aac9fcf738fdbbad6c424993d4b",
  "non_claim": "radiance-reference-records-bounded-source-lineage-execution-and-convergence-facts-without-proving-compiler-correctness-seed-trust-semantic-equivalence-or-universal-reproducibility"
}
